{
  "schema": "urn:algaguard:schema:onboarding:device-credential-metadata:v1",
  "schemaVersion": "1.0.0",
  "credentialId": "11111111-1111-4111-8111-111111111111",
  "deviceUuid": "aaaaaaaa-aaaa-4aaa-8aaa-aaaaaaaaaaaa",
  "deviceId": "AG-000001",
  "certificateSerial": "01A7",
  "fingerprintSha256": "0123456789abcdef0123456789abcdef0123456789abcdef0123456789abcdef",
  "certificatePem": "-----BEGIN CERTIFICATE-----\nU0lNVUxBVEVELVBVQkxJQy1DRVJUSUZJQ0FURS1CWVRFUy1OT1QtQS1QUklWQVRFLUtFWVhYWFhYWFhYWFhYWFhYWFhYWFhYWFhYWFhYWFhYWFhYWFhYWA==\n-----END CERTIFICATE-----\n",
  "issuerDistinguishedName": "CN=AlgaGuard Development Device CA",
  "subjectDistinguishedName": "CN=AG-000001",
  "sanUris": ["urn:algaguard:device:aaaaaaaa-aaaa-4aaa-8aaa-aaaaaaaaaaaa"],
  "notBefore": "2026-07-24T00:00:00Z",
  "notAfter": "2026-10-22T00:00:00Z",
  "issuedAt": "2026-07-24T00:00:00Z",
  "activatedAt": "2026-07-24T00:00:05Z",
  "revokedAt": null,
  "revocationReason": null,
  "status": "ACTIVE",
  "parentCredentialId": null,
  "childCredentialId": null,
  "createdAt": "2026-07-24T00:00:00Z",
  "updatedAt": "2026-07-24T00:00:05Z"
}
